{"$schema":"https://json-schema.org/draft/2020-12/schema","title":"Budget","type":"object","required":["estimatedBudget","currentExpenses","remainingBudget","currency","categories"],"properties":{"estimatedBudget":{"type":"number"},"currentExpenses":{"type":"number"},"remainingBudget":{"type":"number"},"currency":{"type":"string"},"categories":{"type":"array","items":{"type":"object","required":["name","estimated","spent"],"properties":{"name":{"type":"string"},"estimated":{"type":"number"},"spent":{"type":"number"}}}}}}
