{
  "estimatedBudget": 1850,
  "currentExpenses": 0,
  "remainingBudget": 1850,
  "currency": "EUR",
  "categories": [
    { "name": "Alojamiento", "estimated": 450, "spent": 0 },
    { "name": "Vuelos", "estimated": 420, "spent": 0 },
    { "name": "Transporte", "estimated": 280, "spent": 0 },
    { "name": "Comida", "estimated": 330, "spent": 0 },
    { "name": "Actividades", "estimated": 270, "spent": 0 },
    { "name": "Compras", "estimated": 100, "spent": 0 }
  ]
}
